text,topic,id
"I'd be happy to help with your request, what area and what type of cuisine are you looking for?",Restaurant,947
I would like chinese.,,948
I'm afraid our restaurant system is currently down.  Can I help you with something else at this time?,,949
i would like to go site seeing,,950
"Other than the museum previously mentioned, I also suggest checking out the Cambridge University Botanic Gardens on Bateman Street.",Attraction,951
"Ok, I think we've already established the attraction in the town centre. The next thing I need is a HOTEL in the centre that includes free parking.",Hotel,952
"The bold letters tells me no interest in a guesthouse huh?  I ran a search there are two hotels, gonville and university arms.  Any preference?",Hotel,953
"i'd like the gonville please. make a reservation if you can for thursday for 1 person, 3 nights.",Hotel,954
Booking was successful.  Reference number is W0P1SD78.  Anything else I can help you with today?,,955
No. That is all for now.,,956
Thank you for using the Cambridge TownInfo centre. Goodbye.,,957
"Hi, I need a 4 star guesthouse hotel please.",Hotel,958
"I have 21 4 star places, can you tell me what area you would like to be in?",Hotel,959
"The North part of town, please.",Hotel,960
"There are quite a few.  If you'd like a cheap alternative, I can recommend Worth House, on Chesterton Road. Or for a moderate rate, Kirkwood House is next door.",Hotel,961
"Could you book the Kirkwood House for me for thursday, 6 people and 5 nights?",Hotel,962
Your booking was successful. The reference number is 6G15LHZM. Is there anything else?,,963
That is all I needed. Thanks.,,964
"Thank you, goodbye.",,965
I'm looking for a train. The train should leave after 09:00 and should go to broxbourne.,Train,966
What day will this be on?,Train,967
On Sunday.,Train,968
TR941 leaves at 9:01 would you like me to book it?,Train,969
Yes please. I need that booked for 8 people.,Train,970
I was able to get you 8 tickets.  Your reference number is V2XTDMK6.  Can I help you with anything else?,,971
"No, thank you, that is all for now. Have a great day.",,972
You're welcome. Have a great trip!,,973
I'd like for a taxi to take me to autumn house from travellers rest,Taxi,974
Sure thing! What time do you want to leave?,Taxi,975
"I want to arrive by 07:00, what time I leave is okay.",Taxi,976
There's a grey skoda that will be picking you up. You can contact the driver at 07605689057.,Taxi,977
I am staying in west cambridge.  Are there any parks out there to take my kids to?,Attraction,978
There are no parks on the west side of town. Do you want me to search for a park in a different part of town?,Attraction,979
"No, can you look for a museum instead?",Attraction,980
There are 7 different parks on the west side. I would recommend a free park called Kettle's Yard. Would you like more information on it or any other park?,,981
"Are there any museums on the west side of town? I will need the entrance fee, phone number, and postcode.",Attraction,982
There are 7 different museums in the west area. All are free addmission except one. Would you like me to make a suggestion?,,983
"Yes, please pick one for me, and let me know the entrance fee, phone number and postcode.",Attraction,984
I would recommend People's Portraits Exhibition at Girton College. They offer free entrance. Their postcode is cb3ojg. Their phone number is 01223338901.,Attraction,985
Can you book it for me?,,986
"I'm sorry, we don't do bookings for attractions.",,987
"How about a train? I need to go from Stansted Airport to Cambridge on Saturday and arrive there by 08:45. I need departure time, train ID, and price. Thanks!",Train,988
how about TR4194? it arrives at 05:52,Train,989
"Sounds great. I don't need to book it, but I would like the price.",Train,990
The ticket price is 8.08 pounds. The departure time is 05:24. May I help you with something else?,Train,991
No that is all the information I need today.,,992
Your welcome. Have a great day.,,993
That is all. Have a great day.,,994
thank you and have a great day,,995
say hi to your family.,,996
I will thank you.  Goodbye.,,997
"I'm looking for some entertainment in the centre, is there anything interesting to see there?",Attraction,998
"There are tons of things to see in the centre, you'll have a blast. What kind of attraction were you thinking?",Attraction,999
"I was thinking something in entertainment, but if that is not available I would like to know where the swimming pools are.",Attraction,1000
Nothing in the terms of entertainment but there is a swimmingpool. It is called Parkside Pools.,Attraction,1001
that is fine. get me the phone number and address,Attraction,1002
The phone number is 01223446100. The address is gonville place. Do you need anything else?,,1003
I'm also looking for information on a restaurant called rice boat.,Restaurant,1004
"Rice Boat is an expensive Indian restaurant on the west side. Their location is 37 Newnham Road, Newnham. Would you like to book a table there?",Booking,1005
"Yes, please. Can you reserve a table for Saturday for 5 people at 13:45? Thanks.",Restaurant,1006
Booking was successful. The table will be reserved for 15 minutes.,Booking,1007
Can I have the reference number for the booking?,Restaurant,1008
"Yes I will get you that number,one moment please",Booking,1009
I need a place to eat in the south that's expensive.,Restaurant,1010
"There are Chinese, Indian, Italian, and Mexican restaurants that fit that criteria. Do you have a preference?",Restaurant,1011
I would like Chinese or Mexican restaurants,Restaurant,1012
How about chiquito restaurant bar? It's an expensive and delicious restaurant in the south.,Restaurant,1013
"Sure, I need a table for 8 at 17:15 on Wednesday, please.",Restaurant,1014
"Okay, I was able to reserve that table for you. Your reference number is XAL5QLX9.",Booking,1015
"Thank you, what places can you go to that are in the same area?",Attraction,1016
"There are a range of attractions in the south, including parks, nightclubs, a museum, a theatre, a cinema, and more general entertainment venues. What sort of attraction are you interested in?",Attraction,1017
A museum sounds great. Can you get the phone number for one?,Attraction,1018
"Yes, the byard museum is reachable at 01223464646, they have free admission and are located at 14 king's parade, any other questions?",,1019
"That sounds very nice. Can you book me a taxi or car service between those two places? I'd like to arrive by my reservation time, please.",Taxi,1020
"I was able to book a taxi for you. Be looking for a yellow Skoda. If you need to reach them, please call them at 07550666183. Is there anything else?",Taxi,1021
"That would be all, thanks!",,1022
Thank you for using our service. Have a good day. Goodbye.,,1023
I am looking for information on places to go in Cambridge.  Can you help with that?,,1024
I can help with that. Is there a particular area you're interested in?,Attraction,1025
What I'd really like is to find a swimmingpool.,Attraction,1026
"Yes, there are 4 swimming pools that match those requirements. Is there a particular area you would like to go to?",Attraction,1027
Any area is fine. Which of the 4 swimming pools do you suggest?,Attraction,1028
"I personally like Parkside Pools. It's in the center of town, on Gonville Place.",Attraction,1029
Can I get the postcode as well?,Attraction,1030
It is cb11ly. Is there anything else I can help you with?,,1031
I also need a train leaving after 11:00 on friday,Train,1032
"There are 278 trains that meet that criteria. Would you like to narrow down your options by departure site, destination, or arrival time?",Train,1033
My destination is london kings cross,Train,1034
Where will you be departing from?,Train,1035
I am departing from Cambridge.,Train,1036
TR1502 arrives in london kings cross friday at 11:51. Would you like me to book you any seats?,Train,1037
Yes book for 8 people and I need a reference number,Train,1038
I have made that reservation and your reference number is 1702SDBO.,Train,1039
Thanks.  That was all I needed. Goodbye.,,1040
"You're welcome, glad I could help.",,1041
I am looking for a place for a restaurant called anatolia. Can you help me?,Restaurant,1042
Anatolia is a moderately priced Turkish restaurant in the city centre.,Restaurant,1043
Thank you. What is the post code?,Restaurant,1044
The post code is cb21uj. Would you like me to book a table for you?,Booking,1045
No but I do need help finding a train leaving Kings Cross after 15:45.,Train,1046
Okay what day would you like to leave?,Train,1047
The train should go to cambridge and should leave on sunday.,Train,1048
"I found 4 trains departing Kings Cross, heading to Cambridge after 15:45 on Sunday. What time would you like to depart?",Train,1049
I have no preference. I just need to book one of those for 4 people.,Train,1050
"OK, you have 4 seats reserved on TR2952, reference #J5O3AMV7. Can I help you with anything else today?",,1051
No that will be all.  Thank you,,1052
Perfect. Thank you for using the Cambridge TownInfo centre. Enjoy the rest of your day.,,1053
I am looking for a train from cambridge on monday.,Train,1054
"Where is your destination, please?",Train,1055
My destination is Norwich. I am hoping I could catch a train after 15:15.,Train,1056
Will you be traveling alone?,Train,1057
Yes. I will be by myself. Looking for one ticket please.,,1058
"TR9460 leaves cambridge Monday at 15:36, would you like to reserve a seat?",Train,1059
"No, I just need the price and arrival time.",Train,1060
"The price is 17.60 pounds, and travel time is 79 minutes.  Do you need to reserve a seat?",Train,1061
Not at this time. Thanks for the information.,,1062
"More specifically, the train arrives in Norwich at 16:55. If there is nothing more, thank you for calling. Goodbye.",Train,1063
I wanted help with finding a hotel in Cambridge today.,Hotel,1064
"Sure, are you looking to stay on a certain part of town?",Hotel,1065
I don't have a preference.  But it does need to have 4 stars and include free parking.,Hotel,1066
I have two hotels located in the west. One is cheap and one is expensive. One hotel is located in the centre and is expensive. Any preference?,Hotel,1067
Can you tell me the area the cheap one is in and give me it's phone number?,Hotel,1068
The cheap hotel is in the west.  The phone number is 01954714600. Can I help you with something else?,Hotel,1069
"Yes, could you give me information on the cambridge corn exchange?",Attraction,1070
"sure, what kind of information are you looking for?",,1071
I need the postcode please.,Attraction,1072
here you go 	cb236bw,Restaurant,1073
"That is all I need, thank you. Good bye.",,1074
"Have a great day, please let us know if you need any further assistance.",,1075
I am looking for a restaurant serving Persian food in the expensive price range.,Restaurant,1076
"I'm sorry, there aren't any expensive Persian restaurants. Would you like me to check for a different type of food?",Restaurant,1077
How about any restaurant in the centre?,Restaurant,1078
There are 33 expensive restaurants in the center of town. Which cuisine type would you prefer?,Restaurant,1079
"I think I'd like to try Indian food, are there any of those in the center of town?",Restaurant,1080
"There are 6 restaurants that fit your request. Curry Garden, The Golden Curry, Saffron Brasserie, Panahar, Curry King, and Curry Queen.",Restaurant,1081
Any of them would be fine.,,1082
"Alright, shall I make a reservation for the Curry King?",Booking,1083
"Yes please, for 3 people t 15:30 on Friday. Thank you.",Restaurant,1084
Okay done. The reference number for your table is BVK9XZPJ and it is only reserved for 15 minutes.,Booking,1085
That's awesome. Thanks that's all i need!,,1086
You're welcome. Bon appetit!,,1087
I am looking for a restaurant in the centre of Cambridge that serves modern American food.,Restaurant,1088
I was unable to find any restaurants matching that.,Restaurant,1089
Then what about modern European?,Restaurant,1090
I have 4 modern european restaurants in the centre. Do you have a preference on price range?,Restaurant,1091
"No, just pick a popular one for me and book it for 1 person on Tuesday please.",Restaurant,1092
"I  book you a table at riverside brasserie, I will send you the reference number.",Booking,1093
Okay what is it?,,1094
I need to know the reservation time before I can book a table for you.,Booking,1095
"I would like the time to be at 14:00, if you cant get that time 13:00 will do. Can I have a reference number? I also need a train.",Train,1096
Your table has been booked at De Luca Cucina and Bar at 14:00. Your reference number is M81RFLPZ.,Booking,1097
Thank you. I need a train on Tuesday and I need it to arrive by 10:15.,Train,1098
There are several trains arriving in Cambridge before 10:15. Where are you traveling from?,Train,1099
I will be leaving from London Kings Cross.,Train,1100
I can help you with that but first how many tickets will you be needing?,Train,1101
One ticket is all I need. Thank you.,Train,1102
I booked a train leaving at 5:17. Your reference number is LG54YRTF.,Train,1103
Thank you for your help. That's everything I need for now. Goodbye.,,1104
"You are most welcome, have a wonderful day!",,1105
I need help finding a cheap restaurant,Restaurant,1106
What type of cuisine would you like?,Restaurant,1107
I'm interested in European cuisine.,Restaurant,1108
"We have the river bar steakhouse and grill in the centre area, would you like more information?",,1109
Can you book me a table there for 7 on Friday at 19:45?,Restaurant,1110
Yes.  Your booking was successful.  The table will be reserved for 15 minutes.  Your reference number is ODB8T8HO.  Is there anything else I can help with?,,1111
Yes can you help me find a train as well?,Train,1112
Sure! Where would you like to come from? What day of the week and what time?,Train,1113
I would like to leave in Saturday.,Train,1114
We have several options!  Where would you like to go?,Train,1115
I would like to go to Ely please.,Train,1116
Do you have a time you need to leave or arrive by?,Train,1117
The train should arrive by 13:00 and should depart from cambridge.,Train,1118
"Your best best is TR0721, leaving Cambridge at 11:50 and arriving Ely at 12:07. The trains only run every 2 hours on Saturdays.",Train,1119
Okay. Can you go ahead and book that train for 7 people please? And give me the reference number.,Train,1120
"Booking was successful, the total fee is 24.64 GBP payable at the station .Reference number is : OKXUNQ4W",Train,1121
"Thanks for the help, goodbye!",,1122
"You are welcome, enjoy your stay!",,1123
"I'd like to book a taxi from Ask, departing after 19:15.",Taxi,1124
Could you tell me where your destination will be?,Taxi,1125
I need to go to rice house.,Taxi,1126
Could you tell me when you would like to arrive at Rice House?,Taxi,1127
It doesn't matter when I arrive at Rice House as long as the taxi leaves after 19:15.,Taxi,1128
You will be picked up by a black ford and the contact number is 07635928440. Anything else?,Taxi,1129
Nothing else.  Thanks so much for your help.  Bye.,,1130
Glad to be of help. Goodbye!,,1131
Are there any trains arriving by 15:15 on Thursday?,Train,1132
"I can help you with that. What day are you wanting to travel, and where is the destination?",,1133
"I need to go to Broxbourne, I'll be leaving Cambridge.",Train,1134
Okay what day would you like to travel?,Train,1135
I said Thursday.,Train,1136
The TR0071 arrives at 14:01. Would you like to book tickets?,Train,1137
"Yes please book for 8 people. I need the reference number. Also, I want information on a restaurant called Bangkok City.",Train,1138
"Your train is booked, ref #46PQOV6Y. Now, what would you like to know about Bangkok City?",Restaurant,1139
yes how did you know? lol. Can I have their phone number please,Restaurant,1140
Their number is 01223354382. Is there anything else I can help you with?,,1141
That is all thank you goodbye,,1142
You're welcome. Thank you. Goodbye,,1143
"Hi, can you help me find a place to stay? Something moderately priced with free wifi.",Hotel,1144
"I have 17 guesthouses and hotels that fit your criteria, do you have a preference for area?",Hotel,1145
"Not really, but I'm looking for something with 2 stars.",Hotel,1146
The ashley hotel and the lovell lodge are both in the north and are in the moderate price range with 2 stars.,Hotel,1147
Will you book it for a party of 7. 5 days beginning Friday.,Hotel,1148
Booking at the Ashley Hotel was successful. Reference number is : VFGG7DOD. Is there anything else I can help you with?,Hotel,1149
"That's great. No I don't need anything else, thank you.",,1150
Glad we could help you.,,1151
"Need a place to eat, panasian food, pricey!",Restaurant,1152
"I'm sorry, there doesn't seem to be any Panasian restaurants that fall into that price range. Would you like to look for a different type of food?",Restaurant,1153
Thai food would be just as good.,Restaurant,1154
"I have 2 places, would you like the one in the west or centre of town?",Restaurant,1155
"Could I have the postcode, and address of both of them please?",Restaurant,1156
"Sala Thong is at 35 Newnham Road, Newnham, cb39ey and Bangkok City is at 24 Green Street City, Centre, cb23jx.",Restaurant,1157
Thanks. I need a place to stay also. I would like a guesthouse with free wifi. Can you help me find one?,Hotel,1158
I show 23 guesthouses available with free wifi.  Which area of town would you like to stay?,Hotel,1159
"I would like to stay on the east side, please.",Hotel,1160
There are 6 guest houses in the east that offer free wifi. Can I recommend the Autumn House?,Hotel,1161
"Hmm, I've never been there. Let's try that. Can you book me a room for Saturday for 5 guests, 2 nights please?",Hotel,1162
No problem! Booking was successful. Your Reference number is : MJ95SPPP.,Booking,1163
I'd like to book a taxi to take me from the hotel to the restaurant.,Taxi,1164
Which restaurant will you be going to and what time would you like to arrive?,Taxi,1165
"Thank you, I would like to commute from the hotel to Sala Thong, and I want to leave by 06:15.",Taxi,1166
"Ok, I have booked a taxi for you.  Its going to be a blue Audi & the contact number is 07493726924.",Taxi,1167
"Great, you've been awesome. Bye.",,1168
Have a great day and a great trip! Goodbye.,,1169
Can I please get a train ticket from Norwich to Cambridge?,Train,1170
We have many trains available but to help find the right one could you provide me with what day you will be departing and your departure time and arrival?,Train,1171
I will be leaving after 15:15 on Tuesday.,Train,1172
TR4180 leaves at 15:16. Does that work for you?,Train,1173
"Perfect, can I get 8 tickets?",Train,1174
"Booking was successful, the total fee is 140.8 GBP payable at the station .
Reference number is : CO0GWJCJ. Can I help you with anything else today?",,1175
i am also looking for places to go in town. The attraction should be in the type of park.,Attraction,1176
We have a lot of excellent options. Is there a particular area you'd like to visit?,Attraction,1177
"Yes, I would like to visit a park.",,1178
"There are parks in the centre, east, north and south.  Could you please let me know which area you prefer?",Attraction,1179
"The area doesn't matter, can you recommend one?",,1180
There is the Cherry Hinton Water Play park in the east. It's free to get into.,Attraction,1181
Can I get the phone number and the postcode?,Attraction,1182
"Sure, the phone number is 01223446011 and the postcode is cb18dw. Is there anything else I can help you with?",,1183
"Yes, I would like to find a park to go to.  I will need the phone number and postcode.  Also, what is the entrance fee for this?  Thanks!",Attraction,1184
It is free admission.,Attraction,1185
"Okay, that's all I need, thank you so much!",,1186
"Have a nice day, goodbye.",,1187
I'm looking for a 4 star hotel in the north.,Hotel,1188
Are you looking for a specific hotel? Also what type of hotel are you looking for?,Hotel,1189
"Hm, maybe something moderately priced? With free wifi?",Hotel,1190
The avolon would feet your needs. Would you like a reservation?,Hotel,1191
"Yes, I would like it to start Monday and be for 5 nights for 4 people.  Can I get the reference number?",Hotel,1192
"I have booked you a room here is the information-Booking was successful.
Reference number is : CZQ8CCGZ. Any thing else I can help you with?",,1193
I also need a train heading to cambridge on monday as well,Train,1194
Where will you be leaving from?,Train,1195
I'll be leaving kings lynn after 13:15.,Train,1196
I have train TR2257 leaving at 14:11 and arriving at 14:58. Would you like to make a reservation?,Train,1197
"No, that is all I needed. Thank you!",,1198
"Okay, thank you! Enjoy your trip.",,1199
Thank you too!,,1200
Bye Bye.,,1201
I'm looking for a train that leaves from Cambridge.,Train,1202
"There are 1414 trains, what destination do you have in mind?",Train,1203
I'd like to go to Broxbourne and arrive by 21:30.,Train,1204
What day did you have in mind?,Train,1205
I would like to leave on Tuesday and book travel for 8 people. I will also need the reference number.,Train,1206
I've booked 8 tickets for you on the train arriving at 21:01. Your reference number is 4N4R9KBI. Can I help you with anything else today?,,1207
Yes.  I'd like to go to the Cambridge Artworks. Can you provide the address?,Attraction,1208
They are located at 5 greens road,Attraction,1209
"That is their postcode and phone number, please?",Attraction,1210
The postcode is cb13ef and the phone number is 01223902168.,Attraction,1211
Thank you very much! That was all the info i needed.,,1212
"You're welcome, have a lovely day!",,1213
"Yes, I need a hotel in the moderate price range please.",Hotel,1214
Would you like a hotel in the north or the centre?,Hotel,1215
"The north.  But I do need an actual hotel, no guestrooms.",Hotel,1216
I have two hotels available that meet that criteria.  Would you like more information?,Hotel,1217
"Yes, tell me about those.",,1218
Ashley hotel is 2 stars with free internet and free parking lot.,Hotel,1219
What about the other hotel?,Hotel,1220
"Lovell Lodge is also two stars.  In the moderate price range, located in the North, at 365 milton road. It has free parking and wifi.",Hotel,1221
Could you book me a room at one of those? I need it for 6 people and 2 nights starting from saturday.,Hotel,1222
I was able to book you at the Ashley Hotel at 74 chesterton road.  Your Reference number is : PM69RLXB Do you need anything else?,,1223
Thank you so much. That is all I need.,,1224
Enjoy your stay.,,1225
I need to find a 4 star hotel in the north,Hotel,1226
"I found several guesthouses.  There are many in the moderate price range, and one in the cheap range.  Do you have a preference?",Hotel,1227
A moderate price range is fine and I need it to have free parking as well.,Hotel,1228
How about the Acorn Guest House? It's moderately priced and has free parking.,Hotel,1229
Yes please book it for 4 people for 2 nights starting monday for me.,Hotel,1230
Booking was successful! Your reference number is  DXD1MDA6.,Booking,1231
I'm also interested in finding a good Chinese food place near the hotel. Can you help me find one?,Restaurant,1232
"There are three choices.  Hakka and the hotpot which is expensive and golden wok which is moderate, do you have a preference?",Restaurant,1233
I'll take Hakka. Can you book me a table on Monday at 15:00 for 4 people?,Restaurant,1234
"I've reserved your table at Hakka on Monday, 15:00, for 4 people. Your reference number is K6D87RRX. Can I help with anything else?",,1235
"Yes, I will need a taxi to take me from the hotel to the restaurant and back to the hotel.",Taxi,1236
"You are booked to arrive at the restaurant by three, look for a blue ford, the driver can be contacted by phone at 07232608741",Taxi,1237
"Thank you, that will be all.",,1238
"Okay, have a great day!",,1239
"Hello, I'd like some information about a hotel called the hamilton lodge, please.",Hotel,1240
The Hamilton Lodge is a 3 star guesthouse located at 156 Chesterton Road. Would you like to make a reservation?,Booking,1241
Not today I was just looking for information. Thank you though for your help.,,1242
Is that all you need for today?,,1243
I am also looking for a train leaving from Cambridge anytime after 17:00. Can you help me with that?,Train,1244
"Certainly, what day would you like to leave, and where would you like to go?",Train,1245
I need the train to leave Cambridge after 17:00 on Wednesday heading to Kings Lynn.,Train,1246
Great. I have 7 trains that meet your criteria. The first one leaves at 17:11 and is every hour thereafter. Would you like me to book one for you?,Train,1247
What is the cost and trainID for the 17:11 train?,Train,1248
"The cost is 9.80 pounds, and the train ID is TR8627. Would you like me to book it for you?",Train,1249
"No thank you, I'll take care of it myself. I think that'll be all for tonight.",,1250
Thank you for using our service.,,1251
I need a train departing Cambridge and I need it to arrive by 21:00,Train,1252
Where are you headed to? And what day are you traveling?,Train,1253
Looking to go to Stansted Airport on Sunday,Train,1254
I have TR5009 leaving at 18:40 and arriving by 19:08.  Would you like me to book this for you?,Train,1255
book for one person please.,Train,1256
I was able to book that ticket for you. Your reference number is 642J5XG0. Is there anything else I can do for you today?,,1257
Can you give me information about the riverboat georgina?,Attraction,1258
"The riverboat georgina is currently docked on the Northend at Cambridge Passenger Cruisers, Jubilee House, postcode cb43ax. Their phone is: 01223902091. I have no info on their entrance fee. Anything else?",,1259
"No, thanks. You answered all my questions. Thanks so much. Have a good day. Goodbye.",,1260
Have a good day.,,1261
