text,topic,id
I am looking for a restaurant that is expensive and in the west,Restaurant,0
There are 9 matching restaurants. What food would you like?,Restaurant,1
I would really like to try some British food please.,Restaurant,2
I have 2 matching restaurants.  Would you like more details on them?,,3
"No, if you could just book me into one for saturday, that would be great.",,4
"Ok, how many people and what is the time preference?",Booking,5
"I need if for four, 13:30, Saturday.",Restaurant,6
"Sure, you're booked at Travellers Rest with reference number A5LK844G. May I help with anything else?",,7
Okay great no that will be it.,,8
Okay. Glad I could be of help. Please call again.,,9
I'm bored and need to venture out into the centre. What should I absolutely go see?,Attraction,10
"there are lots of museums, colleges, and churches to visit",Attraction,11
What kind of museums are offered in that area?,Attraction,12
There are 11 museums in the centre of town. They are all free to enter.,Attraction,13
Perfect. I also need a train that goes to cambridge and arrives by 20:15.,Train,14
Can I ask where you're departing from and what day?,Train,15
departing from peterborough and going to cambridge.,,16
There are quite a few trains all week that could fit your needs. Which specific day are needing so we can narrow these down a bit.,Train,17
I'll be travelling on Wednesday,Train,18
"Tra TR0922 leaves at 13:17 and you will arrive by 14:L08 that is the latest one,can I book it for you ?",Train,19
May I have the price ?,Train,20
The fare is 23.60 pounds,Train,21
"How long is the train ride from Peterborough to Cambridge, please?",Train,22
The trip will last 50 minutes,Train,23
"Thanks, that's it for today. Goodbye!",,24
Did you want reservations?,Train,25
I'll be requesting a taxi to golden house please,Taxi,26
"Sure thing, when you like to leave by?",Taxi,27
I want to arrive there by 07:00,Taxi,28
You are booked! Your car is a red audi and contact number is 07727005105,Taxi,29
Thank you that is all I need today.,,30
Just to confirm - you wanted picked up at alexander bed and breakfast correct?,Taxi,31
"no, he taxi should depart from hotel du vin and bistro",Taxi,32
"Alright, I'll fix it for you",,33
Thank you for your help,,34
I'm sorry for the mixup. Your taxi is a white lexus. The contact number is 07770889191. Is there anything else?,Taxi,35
That's it for today. Thank you.,,36
You're welcome. And I apologize again for the confusion. If I can help you with anything else in the future don't hesitate to ask.,,37
Find me a train out of Cambridge to london kings cross,Train,38
There are 70 results. Is there a certain day or time you'd like to leave?,Train,39
I need it on Friday and it should arrive at London Kings Cross by 21:45.,Train,40
"TR1006 arrives at 19:51, would that work?",Train,41
I guess that will work. Can you please make a booking for 3 people and when you are through may i also have the booking reference number.,Train,42
Yes I have booked that for you and your reference number is E3M7QM9F.,Train,43
i also need a place to dine.,,44
Is there a particular cuisine or location that I can recommend for you?,Restaurant,45
"Yes, British food in the West would be great!",Restaurant,46
Saint johns chop house serves british food in the west.,Restaurant,47
What is the phone number and postcode to Saint Johns Chop House?,Restaurant,48
01223353110 is the number.,Restaurant,49
May I have the postcode as well ?,Restaurant,50
Here you go cb30ad,Restaurant,51
"Great, thanks very much, that's all I need!",,52
You're welcome. Have a nice day!,,53
I am looking for a restaurant that serves Irish food and is in the expensive price range.,Restaurant,54
There is not a restaurant serving Irish food in the expensive price range.  Would you like another restaurant?,Restaurant,55
Is there an expensive korean restaurant?,Restaurant,56
"Yes, Little Seoul is a Korean restaurant in the expensive price range.",Restaurant,57
Great! Can you give me the address and area of Little Seoul?,Restaurant,58
Little seoul is located at 108 Regent Street City Centre.  May I help you with anything else today?,,59
no thank you good bye,,60
Thank you. Good bye,,61
I need a train to London Kings Cross on Wednesday.,Train,62
I can help with that. Where are you departing from?,,63
"I will be departing from Cambridge, and need to arrive by 08:30",Train,64
The TR1058 Leaves Cambridge at 7:00 and gets into London Kings Cross at 7:51. The cost is 23.60. Would you like to book it?,Train,65
"That won't be necessary, thanks for your help.",,66
Is there anything else you need today?,,67
"Yes, I would like to see an attraction in the centre of town.",Attraction,68
We have many fine attractions in the center of town. Do you have a specific type in mind?,Attraction,69
"Yes, please. Multiple sports would be great. If not, theatre is my second choice.",Attraction,70
"There are no multiple sports places, might i recommend mumford theatre?",Attraction,71
No thank you that will be all,,72
I have more theatre attractions if you're interested.,Attraction,73
"Yes please, can I have the names of some other theater attractions?",Attraction,74
Does the Cambrdige Corn Exchange theatre in the center pique  your interest?,Attraction,75
"That sounds interesting! Can I have their address, entrance fee, and phone number?",Attraction,76
we are unsure of their entrance fee but their address is wheeler street	and phone number is 01223357851,Attraction,77
Great that's all I needed. Thanks for your assistance.,,78
Thank you for using the Cambridge TownInfo centre. Goodbye.,,79
There's some disagreement about what to do about a car accident. Can you help me with that?,,80
"Of course, I can get you the contact information for Parkside Police Station if you'd like.",Police,81
I would like the address and postcode please.,Police,82
"Okay the address is Parkside, Cambridge and the postcode is CB11JG. Anything else you need?",Police,83
"Thank you, goodbye.",,84
You are more than welcome.,,85
Yes I am looking for a restaurant in east cambidge that serves indian food,Restaurant,86
curry prince is one that fits your needs,Restaurant,87
"I will want it for five, on Thrusday, 15:15",Restaurant,88
I have it booked for you. The reference number is LK03FYO8.,Booking,89
Thank you! I also need info on a train. It should leave on friday after 12:45.,Train,90
"Okay, I can help you find a train. What is your destination?",Train,91
I'm going to peterborough.,Train,92
I have a train leaving at 13:06 and arrives in peterborough at 13:56. Would you like to book that train?,Train,93
"Yes, and please let me know the expense and travel time.",Train,94
It is 16.50 pounds and the travel time is 50 minutes. How many will the booking be for?,Train,95
"Actually, I don't need tickets just yet. I'm all set here. Thanks for all your help - goodbye!",,96
"Goodbye, I hope you enjoy your trip!",,97
I've been injured and I need a hospital that is close to this location.,Hospital,98
The emergency department's number is 0122327118. would you like me to contact them for you?,Hospital,99
I am injured and need a hospital.,Hospital,100
"Okay, I have contacted the emergency department for you. Can I have your address?",Hospital,101
I do not know it. Can I have the hospitals phone number?,Hospital,102
sure i have the phone number right here. But like i said i called them for you. here is the number 01223217118,Hospital,103
I would like a train going to cambridge from leicester in the morning.  Can you book a seat for me and let me know the reservation number?,Train,104
"There are trains that leave at 9 minutes past the hour, every hour, all morning. What time would you like to leave?",Train,105
I need to arrive by 10 am please on a Tuesday.,Train,106
How about train 4734?  It arrives in cambridge at 09:54.,Train,107
Sounds good. I need 4 tickets.,Train,108
"Booking was successful, the total fee is 151.19 GBP payable at the station. Your reference number is : MRTSNQMU.",Train,109
I'm also looking for a cinema to visit?,Attraction,110
There are two- one in the south and one in the centre. Which would you like to visit?,Attraction,111
"I would like the cinema in the south please. I need the phone number, entrance fee, and postcode.",Attraction,112
Cineworld Cinema is located in postcode cb17dy.  The phone number is 00872208000 and you'll have to call them directly for entrance fee information.,Attraction,113
Thank you so much for the information.  I will call them.  Have a good day.,,114
"Anytime, happy to help.",,115
Yeah you are very welcome.,,116
Thank you for contacting Cambridge TownInfo Centre.  Have a great day!,,117
"I going to be staying in the centre part of town, what is there to do at that area?",Attraction,118
"There's a lot of popular attractions in the centre of town, including boating, cinema, museums, nightclubs, and much more. Do you have a specific preference?",Attraction,119
"No, I don't have a preference. What's a good place to go to?",,120
"I would suggest the Museum of Archaelogy and Anthropology.  It is located at University of Cambridge, Downing Street and has free admission.",Attraction,121
"May I get the postcode, phone number for that attraction?",Attraction,122
"Yes, the postcode is cb23dz. The phone number is 01223333516. Can I help you with anything else?",,123
"Yes, I'd like information about the Alpha Milton guest house.",,124
"alpha-milton guest house is a moderate priced 3 start guesthouse in the north, it does not have free internet or parking. They are located at 63 milton road.",Hotel,125
That sounds good please book that for 3 people starting on saturday for 5 nights.,Hotel,126
"You are all set, the reference number is C3JA0EZJ, any further questions today?",,127
"I'd like to book a taxi to take me from the museum to the hotel. If possible, I'd like to leave the museum no later than 24:45.",Taxi,128
"Booking completed!
Booked car type	:	grey ford
Contact number	:	07511988882",Taxi,129
"Great. Thank you, that will be all for now. Have a great day.",,130
Okay. Thank you very much.,,131
"Hello, I am traveling soon and can't wait to see some local tourist attractions.  Can you help me find a place to stay when I am there?",Attraction,132
Do you have a preference in area?,Hotel,133
"No, I don''t have an area preference. I would like to stay in a guesthouse with at 4 star rating. I also need WiFi.",Hotel,134
I would suggest the acorn guest house would you like the info?,Hotel,135
Is there another nearby option?,,136
"Yes, there are several options. They are all priced in either the cheap or moderate price range. Do you have a preference?",Hotel,137
"I have no price range preference, do any have free parking?",Hotel,138
The Allenbell is in east. It has free wifi and parking. Would you like me to book that for you?,Booking,139
No thank you. Can you please give me the address?,Hotel,140
"it is located in 517a coldham lane, postcode cb13js",Hotel,141
Could you give me information on Cafe Jello Gallery?,Attraction,142
sure its located in the west and is a museum. Free admission too,Attraction,143
I also need a tax leaving my hotel by 18:30 to take me to the museum.,Taxi,144
"You are booked, look for a ford pinto.  kidding, look for a yellow lexus, the drivers contact info is 07407659393, any further questions?",Taxi,145
"That is all I need today, thank you.",,146
"No problem, have a great day.",,147
Can you help me find a place to stay that is moderately priced and includes free wifi?,Hotel,148
"sure, i have 17 options for you",Hotel,149
Are any of them in the south? I'd like free parking too.,Hotel,150
"Yes, two are in the south and both have free parking and internet. I recommend the Bridge Guesthouse. Would you like me to book a reservation?",Hotel,151
Please. I need a room on tuesday for 5 nights. 4 people will be staying.,Hotel,152
i bookid bridge guest house	and Reference number is : KYKQFY1U.,Booking,153
Thank you so much.,,154
Of course. I can help at any time.,,155
looking for places to go in town. The attraction should be in the north and should be in the type of mutliple sports,Attraction,156
I have nothing matching what you are looking for. Perhaps another area or another attraction?,Attraction,157
I want to stay in the north. Are there any attractions with boats?,Attraction,158
riverboat georgina has nice boats. Are you interested ?,Attraction,159
"I would like their phone number, entrance fee, and address.",Attraction,160
"they are at cambridge passenger cruisers, jubilee house,cb43ax. or call them on 01223902091.",Attraction,161
I also need a hotel. One with free wifi and not too expensive.,Hotel,162
"If you want to stay in the north, the Acorn Guest House is moderately-priced and quite nice. If you want cheap, I recommend Worth House.",Hotel,163
Okay let's try the Acorn Guesthouse.,,164
Okay. Would you like to book a room at the Acorn Guest House?,Booking,165
Can you book it for me and get a reference number ?,,166
"I would be happy to book the Acorn Guest House for you.  Can you please tell me the day, length of stay, and the number of people.",Booking,167
I actually won't need a booking. Can you tell me the star of the hotel and if they offer free parking?,Hotel,168
The Acorn Guest house is a beautiful 4-star guest house. They do offer internet and parking. Would you like me to provide their contact information for future reference?,Hotel,169
"No, thank you. Could I get the entrance fee of the Riverboat Georgina?",Attraction,170
"I am sorry I do not have that information, I can give you their phone number if you would like.",,171
Yes the phone number would be great.  What are their hours?,Attraction,172
"The phone number is 01223902091.  Their website is vague, I'm afraid you'll have to call them for their hours.  What else can I help you with today?",,173
no that is it for now thanks,,174
You're welcome. Have a good visit.,,175
"Hello, I am looking for a place to stay that has free parking in the South area. Can you help me with that please?",Hotel,176
I have four options ranging in price from cheap to expensive ranging in from 3 to 4 stars.,Hotel,177
Are any a guesthouse?,,178
Yes I have 3 guesthouses matching your criteria. Would you like to book one of them?,Booking,179
No I just need you to recommend one for me.,,180
"Aylesbury odge guesthouse,I will book it for you,is there anything else I can do for you ?",Hotel,181
"I don't need you to book it, I just need the phone number and post code please.",Hotel,182
"The phone number is 01223240089, and the post code is cb17sr. Is there anything else I can assist you with?",Hotel,183
"Thanks, also looking for a restaurant in the same part of town in the expensive range. Can you recommend one?",Restaurant,184
the good luck chinese food takeaway is great. Shall i book it ?,Restaurant,185
Please book the restaurant and I also need a taxi.,Taxi,186
"What time would you like to dine, and how many will be in your party?",Booking,187
There will be 6 of us. We'd like 12:15 on Saturday please.,Restaurant,188
Your table is booked (ref# SCHAG4OI). What time do you need that taxi?,Taxi,189
I'd like it to arrive in time to get us there before 12:15.,Taxi,190
Your black ford taxi has been booked and your contact number is 07103139053.,Taxi,191
Thanks. That is all for now.,,192
Okay.  Please call us if we can help you further.  We hope you enjoy your stay.,,193
I'm looking for a particular restaurant called the Pizza Express,Restaurant,194
"There seems to be two locations.  They are both located in the centre of town.  One is on Regent Street City Centre, and the other is on Jesus Lane Fen Dutton.",Restaurant,195
Ok can you suggest one and reserve a table for 6 at 18:30 on saturday and I need the reference number too please,Restaurant,196
"Ok, you are all booked at the pizza express on regent street. Reference number is 1ASQ2S6Y.",Restaurant,197
Thank you! I'm also looking for a hotel called the Autumn House.,Hotel,198
Autumn House is a cheap guesthouse in the east area of town with free internet and parking. Would you like me to book it?,Booking,199
"Yes, I need it for 5 nights starting on Saturday for 6 people.  Please send the reference number.",Hotel,200
I was able to book your room for Autumn House. The reference number is 9IUTQ641. Is that all you need?,,201
"No, I'll also be needing a taxi to get between the two places, I'll need it to get to the restaurant by the booked time.",Taxi,202
you will be riding in a gray toyota contact # is 07710210724,Taxi,203
"Groovy like Greg Brady!  That is everything,  Thank you for your help.",,204
"No problem at all, you have a great trip!",,205
"Hi, I am so excited to see some local tourist attractions on my upcoming trip.  Can you help me find a place to dine when I am there?",Attraction,206
Of course I can help you with that. May I ask your price range and what kind of food you would like to eat?,Restaurant,207
I would like expensive italian food.  What do you suggest?,Restaurant,208
"Does it matter where your restaurant is located? We have four expensive italian restaurants in the center, and one in the south.",Restaurant,209
I would like the one in the South.,Restaurant,210
I would recommend Frankie and Bennys. Would you like any particular information about that restaurant?,Restaurant,211
Please book that one for 5 people on Thursday at 17:30.,Restaurant,212
Booking was successful. The table will be reserved for 15 minutes on Thursday at 17:30. Your reference number is IIL1W17L,Booking,213
I am also looking for a swimming pool.,,214
"I would recommend parkside pools in the centre, would you like more information?",Attraction,215
Where is the area the swimming pool is? Also can i have contact number and Car type of a taxi to commute between these to place on time.,Taxi,216
The pool is located in the centre. For your taxi what time would like to leave the restaurant and arrive at the pool?,Taxi,217
"Well, my reservation is at 17:30 so before that.",Taxi,218
Ok that is reserved the car type is a white skoda and contact number is 07749508592.,Taxi,219
"Great thank you, that was all I needed today.",,220
I hope you have a great trip!,,221
I need a place to stay in the north with a 4 star rating please.,Hotel,222
I have 8 guesthouses in the north.  Would you like some information on the Archway House? It has free parking and internet.,Hotel,223
Is it in the cheap price range?,,224
"No, it's moderately priced would you like another hotel?",Hotel,225
What hotels have free parking?,Hotel,226
I have the archway house that offers free parking. Would you like to make reservations?,Booking,227
"No thank you, could I have the address with postcode and phone number?",Hotel,228
"The address is 52 gilbert road cb43pe, phone number 01223575314. Is there anything else you need today?",Hotel,229
I would like to find a boat in the north of town as well.,Attraction,230
There is the Riverboat Georgina in the north.  Would you like the information for it?,,231
Can you just give me the entrance fee amount and the address?,Attraction,232
"The address is cambridge passenger cruisers, jubilee house. The entrance fee is unlisted. Anything else today?",,233
There is no entrance fee?,Attraction,234
The entrance fee is not available. It is absent from my database.,Attraction,235
"Okay, thank you so much! I don't need anything else then, goodbye!",,236
Thank you so much for using our services.  Goodbye.,,237
I'm looking for a hotel in the centre with free parking.,Hotel,238
I have a few hotels with free parking. Do you want me to go through the whole list with you?,Hotel,239
"No, you don't have to do that. Can you recommend a 5 star hotel?",Hotel,240
"There are no 5 star hotels in the centre with free parking. There are two four star hotels, though. Does cost concern you?",Hotel,241
Is there one with a four star rating?,Hotel,242
"There are two 4 star places, one a guesthouse and one a hotel. Would you like a reservation at one of these?",Booking,243
Can you suggest one please? And I need a postcode.,Hotel,244
The alexander bed and breakfast is cheap and the postcode is cb12de. Would you like to make a booking?,Hotel,245
Can you tell me about the 4 star hotel instead?,Hotel,246
Sure. The University Arms Hotel is on Regent Street in the centre of town.  It is 4 start and expensive.  Is their any other information I can provide?,Hotel,247
I am also interested in a place to dine. I would like to have Asian Oriental cuisine.,,248
What is the price range for you?,Hotel,249
"It's a special dinner, so expensive is fine.  I need a postcode and address with that recommendation please.  Thanks so much!",Restaurant,250
"Sure, did you have a specific kind of cuisine in mind?",Restaurant,251
I'm looking for an Asian Oriental place in the same area as the hotel.,Restaurant,252
There are four restaurants in that area that fit that criteria.,Restaurant,253
4 expensive asian restaurants? Well if so pick the one you'd recommend. Oh and get me the postcode and address.,Restaurant,254
I recommend Kymmoy in the centre. It's located on 52 Mill Road.,Restaurant,255
"Thanks, that's all I needed today.",,256
"Alright, have a lovely day and goodbye.",,257
"Hello, I'm looking for an architecture place to go in the centre of town.",Attraction,258
"there are several architecture places you could go, all saints church,great saint mary's church,holy trinity church, and old schools, which one could you prefer?",Attraction,259
Old Schools sounds cool - can I have their phone number?,Attraction,260
You can contact Old Schools at 01223332320. Is there anything else I can assist you with?,,261
I'm looking for the gonville hotel.,Hotel,262
Gonville hotel is in the expensive price range in the centre would you like me to book it,Booking,263
No can I just get the hotel type and phone number please?,Hotel,264
It is a normal hotel and the phone number is 01223366611.,Hotel,265
Thanks. Can I also book a taxi to take me from the hotel to the old school. I want to leave the hotel by 21:00.,Taxi,266
The taxi has been reserved. Your taxi would be a black honda and you can contact it at 07973129543.,Taxi,267
Thank you so much that's all i need.,,268
Have a good trip at Cambridge. Goodbye!,,269
Good evening. Can you help me find a guesthouse to stay at for the weekend?,Hotel,270
"acorn guest house is in the north part of town and available, when would you like to stay?",Hotel,271
Does it have free WiFi?,Hotel,272
"Yes, it does! It also has free parking.",Hotel,273
Could I get the phone number for them.,Hotel,274
Phone number is 01223353888.,Hotel,275
"Thanks. Oh, I forgot to ask, is that in the moderate price range?",,276
The Acorn guesthouse is in the moderate range. Would you like to book a room?,Booking,277
"No, I'll have to think about it. Thanks though. Bye!",,278
You're quite welcome. Thanks for contacting the Cambridge TownInfo Centre and have a great day!,,279
Can you give me some information on the Allenbell? It's a hotel.,Hotel,280
"It is a 4 star hotel that is cheap, and in the east of town. It is a guesthouse type and phone number is 01223210353.",Hotel,281
I need it for 5 people and 5 nights starting from sunday. I will also need the reference number.,Hotel,282
I have successfully booked it for you. Your reference number is I44610JK.,Booking,283
I'm also looking for a museum in the east area. Can you help me find one?,Attraction,284
"Yes, the Cambridge Artworks is a wonderful museum in the east. Would you like more information?",,285
Yes! Can I have the postcode for it?,Attraction,286
"Sure, the postcode for cambridge artworks is cb13ef.  Do you need any more information?",,287
"Well, I also need to book a taxi.  I want to leave the hotel by 19:30.",Taxi,288
"Certainly I can help with that, will you destination be  from allenbell?",Taxi,289
I want to go to the Cambridge Artworks.,Taxi,290
I have booked a taxi for you. A grey toyota with the contact number 07790143125. Is there anything else you need?,Taxi,291
No. Thank you very much.,,292
"Thank you, please enjoy your stay here in Cambridge. And have a wonderful day.",,293
"Hi, can you please help me find a restaurant that serves Kosher food?",Restaurant,294
im sorry there are no places serving kosher food,Restaurant,295
That's alright. How about Chinese food?,Restaurant,296
"Yeah, there are a lot of options.  Was there a specific part of town or price range you were looking at?",Restaurant,297
I need it to be in the moderate range please.,Restaurant,298
"great, i have four options for you!",Restaurant,299
"cool, which one is the best?",,300
I like the golden wok. Would you like a booking made.,Booking,301
"No thanks. I would like the area, address, and postcode please and I will take it from there.",Restaurant,302
"The Golden Wok is located in the North part of town at 191 Histon Rd, Chesterton.  The postcode is CB43HL.  Is there anything else I can help you with?",,303
I also need a train from Cambridge to Norwich.,Train,304
on which day do you want to travel?,Train,305
I need to leave Monday and arrive by 21:30.,Train,306
"train TR3753 arrives at 	norwich at 09:55, should I book that?",Train,307
"Yes that should work, how much will that cost?",,308
"17.60 pounds per person, also how many shall I book for?",Train,309
That is all I need today thank you for your time.,,310
Have a nice day.,,311
I need to find a restaurant called taj tandoori,Restaurant,312
"Nice place.  It is located at 64 Cherry Hinton Road, Cherry Hinton.  Can I book a table for you?",Booking,313
Yes. I need a place for 3 on Wednesday at 17:15.,Restaurant,314
Great! That booking was successful and your reservation number is K1T4IC74.,Booking,315
I also need a hotel in moderate price range and star rating of 0.,Hotel,316
"Cityroomz matches those requirements. Would you like the phone number, or a reservation?",Hotel,317
Does it have free parking?,Hotel,318
I'm afraid it does not offer free parking. Would you like to book a room?,Booking,319
