text,topic,id
Cineworld Cinema is in the south. Would you like additional information?,,625
"Yes, may I please have their address and phone number.",Taxi,626
"Yes, their address is cambridge leisure park, clifton way and their phone number is 00872208000.",Attraction,627
I also need a taxi to leave the hotel by 22:45. Please provide the contact number and car type.,Taxi,628
"What is your destination, and when do you want to arrive by?",Taxi,629
I'll be going from the hotel to the cinema. I need to leave by 22:45.,Taxi,630
"I booked a grey skoda for you, contact number is 07059639997!",Taxi,631
Thank you so much. That is all that I need at this time. Goodbye!,,632
Thank you. Have a nice day.,,633
I'm planning a trip to Cambridge I am looking for places to go in centre.,Attraction,634
What type of attraction are you looking for?,Attraction,635
"Anything, really, just trying to kill some time. What's your favorite attraction?",Attraction,636
"There are churches, boats, cinemas, museums and colleges in the city centre.  Would you like information on any of them?",,637
Surprise me! Can you send me the postcode of the attraction you choose?,Attraction,638
"You should go see Holy Trinity Church, the stained glass there is simply amazing.  The postcode is cb23nz.  Can I help you with anything more today?",Attraction,639
Yes - I am also looking for a moderately priced restaurant in the same area.,Restaurant,640
There are 21 different restaurants that match your criteria. Do you have a type of food you prefer?,Restaurant,641
"any food will be just fine.Once you find the restaurant you want to book a table for 7 people at 13:30 on friday.
If the booking fails how about 12:30.
Make sure you get the reference number",Restaurant,642
Just to confirm before making a booking: How about Yippee Noodle Bar?  It is in the centre of town and moderately priced.  Would you like this booked?,Booking,643
"Yes, 7 people at 13:30 on friday.",Restaurant,644
I'm sorry but that was unsuccessful. Can I try a different restaurant?,Booking,645
How about 12:30? Are there any tables open then?,Restaurant,646
Yes. they have a table available at 12:30. Your reference number is IB76ZC58. Would you like to write down their address and phone number?,,647
"No thank you, I think that will be all I need.",,648
"Thank you for using Cambridge TownInfo centre, have a good day!",,649
Hello.  Can you find a taxi to pick me up at Darry's Cookhouse and Wine Shop sometime after 04:00?,Taxi,650
Not a problem. Where would you like to go?,Taxi,651
i would like to go to alexander bed and breakfast,Taxi,652
"Great, I've got a white lexus picking you up at 04:00, your contact number is 07605710484.",Taxi,653
Thank you very much. I don't need anything else at this time.,,654
You are welcome.  Have a nice time.  Good bye.,,655
I'm trying to find information about a particular restaurant called Ian Hong house.,Restaurant,656
our records don't show that hotel. sorry,Hotel,657
Are you sure you don't have anything on Ian Hong House? I need the address and postcode.,Restaurant,658
"Yes, I am sure. There is no Ian Hong House restaurant in our system.",Hotel,659
Can you please check again? lan hong house.,Restaurant,660
"Sorry about that! I found the Lan Hong House at 12 Norfolk Street City Centre, cb12lf. It's a moderately-priced Chinese restaurant.",Restaurant,661
"Great, thanks so much. Can I also get help booking a room at the Huntingdon Marriott Hotel please?",Hotel,662
sure for what length of stay and how many people please?,Booking,663
"8 people. 5 nights, starting from Wednesday. Please give me the reference number, please.",Hotel,664
Your booking was successful. The reference number is: USRCWCJ0. Can I help you with anything else?,,665
I would like to book a taxi from the hong house to the hotel leaving by 10:15,Taxi,666
No problem.  I booked a red audi that will pick you up by 10:15.,Taxi,667
"Wonderful, thank you for everything.",,668
Have a great trip!  Thank you for contacting us for all your booking needs.  Enjoy your trip!,,669
One more thing. Can you please give me the taxi contact number.,Taxi,670
Sure!  The contact number is 07686386258.  The car will be a red Audi.,Taxi,671
Thank you very much. Have a great day.,,672
"No problem, have a great day!",,673
I need a train that is departing from cambridge and should leave on sunday.,Train,674
Where will you be going?,Train,675
I will be going to ely and I would like it to arrive by 11:45.,Train,676
Train TR2475 leaves at 07:50 and arrives by 08:07 on Sunday. Would you like to book this now?,Train,677
Could I have the price for that train please?,Train,678
They are 3.52 pounds each,Train,679
Yes could you book that for me?,,680
"Yes, I can book that for you.  Can I confirm that this is for one person, or do you need more than one ticket?",Train,681
Please. I am also looking for a museum in the east please.,Attraction,682
"In the east we have four museums cambridge artworks, cambridge museum of technology, gallery at twelve a high street and saint barnabas press gallery.",Attraction,683
Could you tell me the entrance fee and address for the Cambridge Museum of Technology?,Attraction,684
the entrance fee for cambridge museum of technology is 5 pounds.  shall I get tickets for you if so how many?,Booking,685
That won't be necessary. Can you tell me the postcode for the museum?,Attraction,686
The postcode is cb58ld. Is there anything else I can help you with?,,687
"No thank you, that will be all.",,688
Alright then. Have a wonderful day. Goodbye.,,689
"Hello, what expensive restaurants do you know of in the East part of town?",Restaurant,690
"I have 5, 2 Indian, a Chinese, a British, and a gastropub. Any of them tickle your fancy?",,691
Can you tell me about the indian places? Are any of them expensive?,,692
Sitar Tandoori is my favorite. They are indeed expensive. Would you like to book a table there?,Booking,693
What is their phone number?,Restaurant,694
Their phone number is 01223249955. Would you like to make a reservation? Or can I help with anything else?,Booking,695
I need to find an attraction.,Attraction,696
"There are several attractions in the east part of town. Are you interested in a specific type, such as a museum or outdoors?",Attraction,697
It is  called cambridge book and print gallery.,Attraction,698
"Cambridge book and print gallery is in the west, not the east. Are you sure that was the name of the attraction?",Attraction,699
"Yes, I just need the entrance fee and phone number",Attraction,700
"Good news, the entrance fee is free!  And the phone number is 01223694264.  Can I help you with anything else today?",,701
"No, that's it.  Thank you for your assistance today, you have been very helpful!",,702
Have a great night. I'm glad to be of assistance!,,703
I want to go eat so please find me a restaurant in the South. Money is no object so something expensive please,Restaurant,704
"Sure, I found Chinese, Italian, Indian and Mexican restaurants.  What sounds good?",Restaurant,705
Any of those sound good what do you recommend? I just need the address and type of food they serve.,Restaurant,706
I'd recommend the Good Luck Chinese Takeaway. They serve Chinese cuisine at 82 Cherry Hinton Road Cherry Hinton.,Restaurant,707
Also need a hotel in the same area and same price range.,Hotel,708
"Okay, I have one match. It's The Lensfield Hotel and it is 3 stars. Would you like me to make a reservation for you?",Booking,709
Does it have free wifi?,Hotel,710
"It certainly does. Shall I book it for for you, then?",Booking,711
"No, I just need the address, thank you.",Hotel,712
The address is 53-57 lensfield road. Do you need anything else?,Hotel,713
Nothing else. Thank you for researching the restaurant and hotel. Goodbye.,Hotel,714
Welcome again it has been a pleasure to serve you,,715
Greetings. I'd like some information about vue cinema.,Attraction,716
The vue cinema is located in the centre of the city and the phone number is 08712240240.,Attraction,717
What is the postcode?,Attraction,718
The postcode is cb11ps. Can I help you with anything else?,,719
Yes I am looking for an oriental restaurant that is relatively cheap . Any suggestions?,Restaurant,720
"Dojo Noodle Bar, and J Restaurant are both located in the centre area. Would you like more info on either of these?",Restaurant,721
Yes I would love to hear about either.,,722
Both are in the centre of town and in the cheap price range.,Restaurant,723
What is the phone number and address for Dojo Noodle Bar?,Restaurant,724
The phone number is 01223363471 and the address is 40210 Millers Yard City Centre.,Restaurant,725
"Wonderful, now I will need a taxi to commute between the two. I want to leave the cinema by 20:45 to get to the restaurant.",Taxi,726
"Ok, not a problem! You will be looking for a yellow volkswagen and the taxis phone number is 07352155369.",Taxi,727
Thanks so much!,,728
Is there anything else I can do for you today?,,729
That is everything! Thank you for all your help!,,730
Have a good day!,,731
I need to find a place to eat in Centre.,Restaurant,732
There are many restaurants in centre. Did you have a specific price range or cuisine style you prefer?,Restaurant,733
moderate and British please.,Restaurant,734
Restaurant one seven looks good and is British in the moderate price range.,Restaurant,735
Great! Can I book a table for one at 13:45 on Thursday?,Restaurant,736
Booking was successful they will hold the table for 15 minutes and the reference number is QJMICCEY. Is there anything else I can help with?,,737
Yes.  I am also looking for a train departing from cambridge.,Train,738
Ok what time will you be departing from cambridge? What is your destination?,Train,739
My destination is kings lynn and I need to arrive by 18:15.,Train,740
There are quite a few trains that will arrive at the time. What time would you prefer to depart?,Train,741
What's the last train that gets to Kings Lynn by 18:15 Friday?,Train,742
That would be train TR9226. It arrives at 17:58.,Train,743
What time does that train depart?,Train,744
It departs at 17:11.,Train,745
Perfect. Please book that train for one person.,Train,746
"I was able to book it, reference number is I4012ZAZ.",Train,747
"I actually didn't need that booked just yet, but that will probably save me some time, so thanks! That's all I needed.",,748
Great! Have a good trip.,,749
I am coming to Cambridge and would like to see some architecture. Do you have any located in the centre?,Attraction,750
"Yes, there are 5 places located in the centre. I recommend the All Saints Church on Jesus Lane.",Attraction,751
Thanks! What's the entrance fee?,Attraction,752
"There is no entrance fee, it is free. Is there anything else I can help you with?",,753
"I'd like to find a guesthouse to stay at. I want it to be nice, so I'd like an expensive one.",Hotel,754
It seems like all of my guesthouses are in different price ranges. No expensive ones are listed. Can I interest you in a different price range?,Hotel,755
Well then I need a hotel that has free parking and a 4 star rating.,Hotel,756
I've found three hotels matching your preferences. The University Arms Hotel is in the expensive price range and is located in the centre of town if you are interested.,Hotel,757
I would like a guesthouse in the moderate price range that has 4 stars and includes free parking.,Hotel,758
"I have 9 total guesthouses that meet your needs. They are located in the north, east, and south. Do you have a preference?",Hotel,759
Can you recommend one?,,760
acorn guest house seems like a nice place because it is the first one on my list how about that one its probably not too shabby,Hotel,761
"OK, that one sounds great!",,762
Would you like me to book it for you?,Booking,763
"Yes, book it for 5 people for 4 nights starting Thursday.",Hotel,764
Unfortunately the booking was not successful.,Booking,765
What if we try two nights?,Hotel,766
Your booking was successful with a reference number of VZRQHFHP. Can I help you with anything else?,,767
Thanks great. Also I need to have the phone number for All Saints Church on Jesus Lane.,Attraction,768
Sure All Saints Church's phone number is 01223452587. Anything else?,,769
Not at the moment. Thank you.,,770
Thank you for using our service. Have we met all of your needs today?,,771
"Yes, you have. Thank you. Have a good day.",,772
You as well! Good bye!,,773
I will be visiting family in the south part of cambridge and we would liek to get one last boating excursion in.  Any boating places in the south area?,Attraction,774
It looks like there isn't any boating in the south area.  Would you like me to look in a different area of town?,Attraction,775
How about a nightclub in the south?,Attraction,776
"Sure, The Place is on 22 sidney street and the postcode is cb23hg. Phone number is 01223324600.",Attraction,777
Thank you for all your help.,,778
Is there anything else I can help you with?,,779
i would like place to stay. The hotel should be in the type of guesthouse and should include free wifi,Hotel,780
aylesbray lodge guest house is a nice four star guesthose with internet available. Would you like me to book you a room?,Booking,781
I would prefer a guest house that has one star.  Is there one available also with free wifi?,Hotel,782
"No, I'm sorry there are no 1 start guesthouses offering free wifi. Is there anything else I can help you with?",Hotel,783
"Okay, the four will be fine, then. I don't need to book, yet. Thanks for your help.",,784
No problem. Are you sure you don't want to go ahead and make a reservation?,Booking,785
Can you book it for 4 people for 2 nights starting friday?,Hotel,786
Okay.  I have a reservation for 4 for two nights starting Friday.,Booking,787
"I would like to get information about some tourist attractions in Cambridge, especially those located in town.",Attraction,788
We have many wonderful attractions in the area. Is there a specific type of attraction or area you are looking for perhaps?,Attraction,789
I am looking for a nightclub in the centre and a phone number.,Attraction,790
We have 5 nightclubs in the Centre. Would you like me to make a recommendation?,,791
"Yes, a suggestion would be very helpful along with the phone number so I can call them.",Attraction,792
I would recommend the Ballare Club. Its phone number is 01223364222. Is there anything else I can help you with?,Attraction,793
"Yes, I am also looking for a restaurant in the same area. I am looking for an expensive restaurant that serves Scandinavian food.",Restaurant,794
There are no Scandinavian restaurants in the centre with an expensive price range. Would you like to try a different type of food or price range?,Restaurant,795
What about Indian food?,Restaurant,796
I have 6 restaurants that meet your criteria. Would the Panahar work for you? It's at 8 Norfolk Street City Centre.,Restaurant,797
That sounds great. Please book it for 3 people on Thursday at 16:30,Restaurant,798
I was able to book a table at Panahar for 3 people on Thursday at 16:30. The reference number is 5SIQAVA,Booking,799
Thank you for your help!  I appreciate it!  Goodbye.,,800
You're welcome. Have a great time!,,801
I want to know about the Cambridge and County Folk Museum,Attraction,802
"It is a lovely museum located in the west part of town, at 2-3 castle street.  Can I get a phone number for you?",,803
No but I do need the address please.,Attraction,804
The address is 2-3 castle street.,Attraction,805
Great!  I also need a moderately priced hotel that is in the east.  Can you help?,Hotel,806
Is free paring and internet important to you?,Hotel,807
Free wifi would be great. I don't care about the parking.,Hotel,808
I found a few guesthouses.  Would that type of room be ok with you?,Hotel,809
are any of them a 4 star?,Hotel,810
I have three that are 4 star. Shall I book one?,Booking,811
"Yes, please book for 5 people and 2 nights starting on wednesday.",Hotel,812
"Okay, I recommend the Warkworth House. I want to make sure this is okay with you before I go ahead and make a reservation.",Hotel,813
"Yes, that sounds great. Can I please have the reference number as well?",Hotel,814
Your reservations have been made for five people for two nights beginning Wednesday.,Booking,815
I need a train leaving on Friday.,Train,816
Where are you departing from and what is your destination?,Train,817
The train should depart from cambridge and should go to ely.,Train,818
Is there a particular time you'd like to leave?,Train,819
I would like to leave on Friday and should arrive by 08:15.,Train,820
"Booking was successful, the total fee is 4.4 GBP payable at the station .
Reference number is : 57E550PF.",Train,821
I'm looking for places to go in town. Can you search in the area of south?,Attraction,822
We have several great options. The Byard Art museum is popular and has free admission.,Attraction,823
That sounds lovely. What's their phone number?,Attraction,824
Oh they really are lovely. And the number is 	01223464646.,,825
Thank you. I am also looking for an expensive Italian restaurant.,Restaurant,826
"Sure, there are 5 expensive Italian restaurants for you to choose from. Is that a specific area you would like the restaurant to be in?",Restaurant,827
I'd like one near the museum in the south.,Attraction,828
We only have one listing for an Italian restaurant in the south.  It's located at Cambridge Leisure Park Clifton Way Cherry Hinton.  Does this interest you?,Booking,829
Yes.  I need a table for 8 at 11:00 on Tuesday.,Restaurant,830
I was able to book the table for eight on Tuesday 11:00.  The reference number is  R8O6B9DF.  The table will be reserved for 15 minutes.,Booking,831
"Thank you, can I also get a taxi between the two places?",Taxi,832
Absolutely! When would you like to arrive at or leave by?,Taxi,833
I'd like to get to the restaurant by my reservation time.,Taxi,834
I was able to book a black honda contact number is 07790378961,Taxi,835
Thank you so much. You took care of everything. Thanks. Bye.,,836
Thank you for using our service. Have a great day! Goodbye.,,837
"Hello, I am looking for an expensive restaurant that is on the east side of town.",Restaurant,838
Grafton Hotel restaurant is an expensive restaurant in the east part of town.,Restaurant,839
What is the postcode?,,840
"The postcode of grafton hotel restaurant is C.B 2, 1 U.J.",Restaurant,841
"What is the address, phone number, and type of food?",Restaurant,842
"The Grafton Hotel restaurant serves British food. It is located at Grafton Hotel 619 Newmarket Road Fen Ditton, and it's phone number is 01223 241387.",Restaurant,843
"Great, thank you!",,844
Do you need any further information?,,845
No thank you.  Goodbye!,,846
Thank you.  Have a nice day.,,847
You too!,,848
Bye.,,849
I am looking for a restaurant in the west part of town.,Restaurant,850
"Cambridge Lodge Restaurant is in the west part of town, and it serves European food.",Restaurant,851
Thank you. Can I have the address please?,,852
Yes.  Their address is 139 Huntingdon Road City Centre.,Restaurant,853
Thank you. I would like their price range and phone number as well please.,Restaurant,854
Cambridge Lodge Restaurant is in the expensive price range and the phone number is 01223 355166.,Restaurant,855
"Thank you, goodbye.",,856
You're welcome. Goodbye.,,857
Goodbye.,,858
Enjoy your dining experience.,,859
I've been a victim of a robbery. Can you help me?,,860
Sure! I think you'll need the police. Their contact number is 01223358966.,Police,861
Which department is this?,,862
The police department,,863
Thank you very much.,,864
You're more than welcome!,,865
I'm looking for the Cherry Hinton Hall and Grounds.,Attraction,866
Great choice! The Cherry Hinton grounds are located in the east. It is located on Cherry Hinton Road. Their contact info is 01223446104. Any other information I can offer you?,,867
"Yes, could you give me the postcode please?",Attraction,868
The postcode is cb18dw. Is there anything else you need?,,869
I want to find a hotel in the west. It needs to have free parking.,Hotel,870
"There are two hotels that meet those criteria.  The Huntingdon Marriott is an expensive hotel, and the Cambridge Belfry is a cheap. Which one would you prefer?",,871
I will try the Huntingdon Marriot.,,872
Would you like me to book you a room at the huntingdon marriott hotel?,Booking,873
"Yes, I need a room starting on tuesday.",Hotel,874
"How many nights would you like it to be reserved, and how many will be in your party?",Booking,875
I will need three nights and with 5 people.,Hotel,876
I was unable to book for 5 nights.  Would you like to try for 4 nights?,Booking,877
"Actually I was mistaken, I need it to be booked for 6 people for 2 nights starting Tuesday.",Hotel,878
I'm unable to book two nights for six people.  Would you like to try for one day?,Booking,879
Yes please. One day is fine.,Hotel,880
The booking was successful. The reference number is 1FN4UUGJ. What else can I help you with?,,881
I also need a taxi to get me between the two places please.,Taxi,882
When would you like to leave or arrive?,Taxi,883
I'd like to leave by 16:15.,,884
Okay sure. I have booked a white BMW to pick you up and your contact number is 07340002030. Anything else?,Taxi,885
That takes care of everything. Thank You!,,886
Thank you for using our system!,,887
Hello!  I am planning my trip to Cambridge and need information on places to stay.,,888
ok Id be happy to help with that would you like a guesthouse or Hotel,Hotel,889
i don't have a preference. I would like a room with a 0 star and free parking,Hotel,890
Okay there is city centre north b and b would you like me to book it for you?,Booking,891
I prefer one in the east. How about a 4 star hotel with free parking there instead?,Hotel,892
There are no 4 star hotels in the east section of town that offers free parking. Would you like to search for a guesthouse?,Hotel,893
Yes that is fine I need the price range as well.,Hotel,894
I have several options in the cheap or moderate price range with parking and wifi. How does the leverton house sound?,Hotel,895
What is the price range of the Leverton House?,Hotel,896
It's cheap. Would you like me to book a room for you?,Booking,897
Yes please. I also need a train that leaves after 9:00 on sunday,Train,898
Can you please tell me how long your stay at the Leverton will be? What day will you be checking in and how many people?,Hotel,899
"Actually, I apologize no need to book, I was just gathering information.  But I do need information on a train from leicester to cambridge.",Train,900
TR1079 leaves at 09:09 would that work for you?,Train,901
That works for me.,,902
"Is there anything else I can help you with today, bookings or more information?",Booking,903
"Can you tell me the price of the train ticket, please?",Hotel,904
The price of the train is 30.24 pounds.,Train,905
"Thank you so much, that's all I need.",,906
You are very welcome! I hope you have a wonderful visit.,,907
I hope so. Can I call any time?,,908
"We are available anytime, enjoy the rest of your day.",,909
Are there any Chinese restaurants in the centre part of town?,Restaurant,910
jinling noodle bar is in the centre abd serves chinese food,Restaurant,911
Are they expensive?,,912
They are in the moderate price range.,Restaurant,913
"Please look for something else in the expensive price range. I will need the address, post code and phone number.",Restaurant,914
Does the Jinling Noodle Bar sound like a good choice?,Restaurant,915
"Sure! What's the address, postcode, and phone number of it?",Restaurant,916
"their address is 11 Peas Hill City Centre, postcode is cb23pp , and phone number is 01223566188",Restaurant,917
thank you for your help,,918
Thank you goodbye,,919
"Hi, could you help me with my plans?  I am looking for a train.",Train,920
I can help you with that. Where will be departing and where do you want to go?,,921
I will be departing from Cambridge and going into Ely on Saturday.,Train,922
Trains run that route every two hours throughout the day. Do you have a target departure or arrival time?,Train,923
I would like to arrive in Ely by 11:15.  Could you please tell me the price and what the departure time is?,Train,924
TR0718 arrives at 10:07 on saturday.  Cost is 3.52 pounds.  Would you like me to reserve a seat for you?,Train,925
I need to book a room in the North as well.,Hotel,926
"There are 2 hotels and 11 guesthouses to choose from in the north, ranging in price from cheap to moderate. Do you have a price point preference?",Hotel,927
I would need a hotel with wifi,Hotel,928
There are 12 hotels that fit your criteria. Do you want a moderately priced or cheap hotel?,Hotel,929
"I don't care about the price. I absolutely do need free parking, though.",Hotel,930
Do you have a star rating preference?,Hotel,931
I do not have a preference on the number of stars.,Hotel,932
Can I suggest the acorn guesthouse? It's moderately priced and has 4 stars.,Hotel,933
I want it to be in the type of hotel. It should have wifi and parking too. And it must be in the north.,Hotel,934
We have two option for you. We have the ashley hotel and the lovell hotel. Both have your commendations you want.,Hotel,935
Book me with the Ashley Hotel please.,Hotel,936
"I'd be happy to do that. What is your arrival date, how many in your party, and how many nights?",Booking,937
its for 5 for 5 nights monday.,Hotel,938
"Your room is reserved, ref# W4VW9W7M. Is there anything else I can help with today?",,939
"Thanks so much, no that will be all.",,940
I am glad I was able to accommodate your needs.,,941
Is it true Cambridge has the best attractions?  We are looking for something unusual to do in the centre.,Attraction,942
There is teh museum of archeology and anthropology in the centre that is free of charge,,943
That's perfect. Thanks so much for your help.,,944
You're welcome. Is there anything else I can assist you with?,,945
Yes can you help me find a place to eat too?,,946
