text,topic,id
Is there anywhere else which would offer free parking?,Hotel,320
Not with those criteria. We could start a new search if you like.,Hotel,321
how about a cheap hotel with free parking?,Hotel,322
I have two guesthouse available. They both offer free parking and are 0 stars. One is in the north and one in the centre? Do you want a specific area?,Hotel,323
The area doesn't matter. Can you pick one and book a room for 3 people for 5 nights on Wednesday.,Hotel,324
I was able to book you at el shaddai. Your Reference number is : 4WHOTORJ.,Booking,325
"Can I get a taxi from the hotel to the restaurant, I would like to arrive shortly before the booking time.",Taxi,326
"I have booked your taxi. Your car is a blue volkswagen, they can be reached at at 07653689405 if you have any questions. Can I assist you with anything else?",Taxi,327
"No, I am all set for today.  You have been very helpful.  Thanks.  Bye.",,328
Thank you for using our service. Good-bye!,,329
"Hi, could you help me find a train departing from London Kings Cross?",Train,330
I'd be happy to help you find a train. What is your destination?,Train,331
I'll be going to cambridge on thursday.,Train,332
Trains run that route every couple of hours. Do you have a preferred time to leave or arrive?,Train,333
I'd like to arrive by 20:00.,Train,334
"The latest arrival is TR1149 at 17:17, is that ok?",Train,335
Sounds great. When will that be leaving the station?,,336
This train leaves at 17:17.,Train,337
get me the price. also find me  a 4 star hotel in the north,Hotel,338
I do not have any in the north. What else can I help with?,Hotel,339
What about a Guesthouse in the North? Can you find me one?,Hotel,340
There is the Acorn Guest house. It has 4 stars and is moderately priced.  Would you like for me to book it for you?,Booking,341
Can you just tell me the address please?,Hotel,342
Price for the train is 23.60 pounds. THe hotel is located at 154 chesterton road.,Train,343
Can you book the room for me?,,344
"I would be happy to book that for you. Can you tell me what day you will be checking in, how many people and for how many days?",Booking,345
I don't need to book a hotel just need the address and price range.,Hotel,346
It is a moderate priced guesthouse. They can be contacted at 01223353888. Is there anything else I can help you with?,Hotel,347
"That is all, thank you.",,348
thank you and enjoy your stay in cambridge,,349
Do you know what this city might have in entertainment venues?,Attraction,350
"There are two entertainment venues in the east, two in the south and one in the west area of town.  Do you have an area preference?",Attraction,351
"I don't care about the area.  If you were me, which one would you enjoy the most?",Attraction,352
"I would pick whale of a time in the west, located at Unit 8, Viking Way, Bar Hill, postcode cb238el. It is always an adventure there!",Attraction,353
Is there a place to stay with a moderate price range and free parking?,Hotel,354
Which area and type of lodging do you prefer?,Hotel,355
I'm looking for a place that is moderately priced and has free parking.,,356
The Acorn Guest House is a great little 4-star place on the north side. They're moderately priced and have free parking and internet. Would you like a room there?,Hotel,357
That is all the information I need. Thank you!,,358
You're very welcome. Have a great trip!,,359
Wait! I do want the hotel reservation. Can you book it for me on Thursday for 4 nights for 4 people?,Hotel,360
"Your room at the Acorn is booked, ref#94RRN05R. Is there anything else I can help you with today?",,361
No that is all the info I need. I'm sure of it this time ha ha. Thank you!,,362
you're welcome to use our services anytime,,363
I want a restaurant in the town centre. Can you help me?,Restaurant,364
We have 69 restaurants available.  Could you specify type or price range please?,Restaurant,365
I'm looking for a moderately priced restaurant. I'm looking to book for just myself at 14:00 on Friday.,Restaurant,366
Okay I took the liberty of booking you into the Oak Bistro that serves traditional British food. Your reference number is BA2MQ3EB.,Restaurant,367
That sounds perfect. Thanks for your help!,,368
Have a wonderful day!,,369
I am looking for a train going from cambridge to london liverpool street,Train,370
I have many trains available between Cambridge and Liverpool Street. What day are you looking to travel?,Train,371
I would like to travel on Tuesday and I would like to arrive by 20:15 please.,Train,372
I have train TR7299 that leaves at 5:59 and arrives at 7:27.  Would you like to book that?,Train,373
Do you have a train that arrives closer to 20:15.,Train,374
"Yes,  TR9561 arrives at 19:27.  Would you like to book that train?",Train,375
"Yes, I need 7 tickets.",Train,376
Will you needing a reference number?,,377
Yes please.  I'm also looking for a hotel in the west.  I need free parking and wifi available.  Thanks so much.,Hotel,378
Your train was booked successfully for 7 people. Your reference number is MQRGDBZA. There are many hotels located in the west. Are you looking for something in a certain price range?,Hotel,379
A 3 star hotel in the cheap price range,Hotel,380
Im sorry I have nothing matching that criteria can we adjust the amenities?,Hotel,381
Need a train leaving on Thursday after 14:30,Train,382
I found 195 trains that match your prerequisites. What is your destination?,Train,383
I am going to London Liverpool Street from Cambridge.,Train,384
Train TR3237 arrives at 17:27 and cost 16.60 pounds. Would you like me to book it?,Train,385
"No thanks, I'm not sure how many seats I'll be needing yet.",,386
Okay. Just call us back when you do.,,387
"Oh, I am also looking for an African restaurant in the centre...North African, to be exact.",Restaurant,388
"There aren't any in that particular area, do you have any alternative preferences?",Restaurant,389
"Hmm, can you see if there might be an expensive restaurant that serves specifically ""north african"" food in the centre of town?",Restaurant,390
"I apologize, but we are don't have any North African restaurants in this town at all. I do have an expensive African restaurant in the centre. Will that suffice?",Restaurant,391
"No, if I can't get North African I'd really prefer something radically different. Chinese, maybe?",Restaurant,392
How about the Ugly Duckling? They serve chinese food and are located in the centre of the city.,Restaurant,393
Okay. can you book me a table for 7 at 11:00 for Thursday?,Restaurant,394
That booking was unsuccessful. Would you like to try another time?,Booking,395
"Sure, can we try for 10:00 instead?",Restaurant,396
Booking for 10:00 was successful. Your reference number is XVUUCPBH. Is there anything else I can help with?,Restaurant,397
"That will be all, thank you very much.",,398
You're welcome. Have a great day!,,399
I am looking for a place to go in town. Preferably a park that is in the east.,Attraction,400
Cherry Hinton Water Play is in the east side. Anything else I can do for you?,,401
"Yes. Please get me their address, phone number and their entrance fee.",Attraction,402
"The park is located at Cherry hinton Hall, Cherry Hinton Road. The phone number is 01223446100 and is free to enter. Is there anything else I can do for you?",,403
"Yes, I'm also looking for an expensive restaurant that serves Jamaican food.",Restaurant,404
"I'm sorry, but there are no Jamaican restaurants anywhere in Cambridge. We do have plenty of expensive restaurants, though, so I could find you a different cuisine.",Restaurant,405
"That is fine, how about a restaurant that serves Asian oriental food?",Restaurant,406
"There are two expensive Asian oriental restaurants in Cambridge, one in the north and the other in the centre. Which would you prefer?",Restaurant,407
"Let's try the one in the north. I'd like to book a table for 4 at 19:00 on Wednesday, please.",Restaurant,408
"I'm sorry, there were no more tables available. Would you like to try the other restaurant, or a different time?",Booking,409
I would like to try the other oriental restaurant for the same time 19:00 for party of 4.,Restaurant,410
"I'm very sorry, neither of these restaurants have availability at that time on Wednesday.  Would you like to try another time/day?",Booking,411
Can any of them do a time at 18:00? I'll also need a taxi to travel inbetween two locations.,Taxi,412
Your booking for Kymmoy restaurant was successful and your reference number is 5IFCHKNS. The information for you taxi is a Grey Tesla and its contact number is 07674543654.,Taxi,413
Wonderful. Thanks for your help. That's all I needed.,,414
You're welcome. Have a great time!,,415
I would like to know a few attractions to visit in town around the Cambridge centre.,Attraction,416
"There's the architecture of the churches and schools. There are also cinemas, colleges, and boats.",Attraction,417
I am interested in something in the centre of town.,,418
There are 44 different attractions to visit in the centre of town. Is there a specific kind of attraction in mind. Perhaps a museum?,Attraction,419
"That sounds nice. What would you suggest? I'm not too picky really, just looking for a new place to visit.",,420
"I have ballare,it is a nightclub and is very nice.",Attraction,421
Can you send me the address?,,422
"The address for Ballare is Heidelberg Gardens, Lion Yard. Is there anything else I can help you with?",,423
"Yes, im also looking for a moderately priced restaurant that serves world food.",Restaurant,424
There are no results. Is there another search I can try?,,425
How about italian food instead?,Restaurant,426
pizza hut cherry hinton is a italian great place to eat. Shall i book it for you ?,Booking,427
"Yes, please!  I need a 16:45 booking for two on Friday.",Restaurant,428
Booking was successful. The table will be reserved for 15 minutes.Reference number is : H43JKOEL.,Booking,429
I also need a taxi. It should arrive at the restaurant by 16:45,Taxi,430
Will you be leaving from Ballare?,Taxi,431
"Yes, I am leaving from Ballare.",Taxi,432
Booking is complete a blue toyota will pick you up.,Taxi,433
"Do you have the taxi's reference or confirmation number, please?",Restaurant,434
"No, only informatin I have is Booked car type	:	blue toyota
Contact number	:	07110577861",Taxi,435
"okay, that will be all for now. Thank you for all your help.",,436
Alright. Thanks for calling.,,437
I need to find a British restaurant in West Cambridge.,Restaurant,438
There are multiple options for you. To narrow them down what price range do you have in mind?,Restaurant,439
"No, can you recommend a favorite?",,440
"I would recommend Graffiti.  It is a bit expensive, so if you want something moderately price there is also Saint Johns Chop House.",Restaurant,441
Please book 2 tables for 8 people on friday also i need train tickets for 8 people.,Train,442
What time would you like these reservations?,Booking,443
Graffiti sounds good.  I actually need that reservation for 5 people at 20:00 on Wednesday. Can I have the reference number for that?,Restaurant,444
"Booking was successful. The table will be reserved for 15 minutes.
Reference number is : YYPPDY56. anything else i could help you with?",,445
I would also like a train departing from london liverpool street and arriving in Cambridge at 09:00 on the same day.,Train,446
There are two trains that would work. One arrives at 07:07 and the other arrives at 01:07. Which one would you prefer?,Train,447
Can you book the train that arrives at 07:07 that one would work great. I need the reference number as well.,Train,448
"i can definitely do that, how many tickets would you like?",Train,449
it's for the same group of people,Train,450
"Alright, I've booked a train for your group, the reference number is AOIMGBHK, and there will be an 83 GBP fee at the station.",Train,451
"Great, thanks!  That's all I needed right now!",,452
You're welcome. Have a great day.,,453
"Hello, I'm looking for a cheap place to stay. It doesn't need to have free parking.",Hotel,454
Alexander bed and breakfast is available in the cheap price range.,Hotel,455
I also need free wifi and a 0 star rating please.,Hotel,456
I don't see any hotels with free internet in cheap price range.,Hotel,457
"Ok, then, is there one that is cheap and offers free parking instead?",Hotel,458
No there is not one that matches that criteria.,Hotel,459
"Ok, I will try again later.",,460
"Hold on, I had mistakenly listed you as not wanting free parking (rather than not caring if they did). I have two gueshouses that offer both parking and internet.",Hotel,461
I want which ever one is close to town.,,462
How about the el shaddai? I will need to know how long your stay is going to be and how many is in your party please,Hotel,463
Sure.  There will be 5 of us for 4 nights starting Monday.,Hotel,464
The el shaddai was full but I was able to book you at the city centre north b and b. Reference number XLPM3FVL.,Booking,465
Perfect thanks so much for your help that was all I needed today.,,466
You are welcome.  Enjoy your stay.  Bye.,,467
Can you help me find a place to stay? It'll need to have free parking.,Hotel,468
they are many. what is your price range and prefered side?,Hotel,469
I just am looking for a 1 star hotel in the north.,Hotel,470
"I'm sorry, there aren't any hotels that meet your criteria. Would you like to try something else?",Hotel,471
Sure. How about 4 stars?,Hotel,472
"That narrows it down to about 7 options. I have 6 moderately priced ones, and 1 cheaper one. Do you have a preference?",Hotel,473
A moderate priced one will be fine. Any will do. I'll need it booked for Wednesday. I will be staying 2 nights with 6 people.,Hotel,474
"Okay, I made you a reservation at the acorn guest house. Your reference number is 5MSB4H92. Can I do anything else for you today?",Booking,475
Now i need a place to dine. Cheap and Belgian food sounds good.,Restaurant,476
I do not have anything matching that criteria. Is there another type of food you would like to try?,Restaurant,477
How about Indian food?,,478
What area would you like to be in?,Restaurant,479
The area doesn't matter.,Restaurant,480
There are 4 indian restaurants that meet your criteria. I would recommend kohinoor. I really enjoy their food.,Restaurant,481
Can you reserve a table for me?,,482
"Sure, what day, time, and number of people would you like to book it for?",Booking,483
I would like the booking for wednesday at 19:45 for a group of 6,Restaurant,484
"I have you booked at mahal of cambridge, the reference number is 4B8HXAF2",Booking,485
"Lastly, I need a taxi between the two places, I would liek to get to the kohinoor restaurant by the booked time of 19:45.",Taxi,486
"Booking completed!
Booked car type	:	black skoda
Contact number	:	07910219263",Taxi,487
thanks for your help and have a good day,,488
you're very welcome!,,489
I'm so tired. Really need a place to lay my head for the nights. Can you find me some 3-star lodgings somewhere in the south?,Hotel,490
Absolutely!  There is the Bridge Guest House which is moderately priced and The Lensfield Hotel which is more expensive. They are both 3-star establishments in the South.,Hotel,491
Does the Lensfield Hotel include parking?,Hotel,492
"Yes, it does include parking. Would you like me to make a booking?",Booking,493
Yes please book that for 6 people starting Thursday for 5 nights? I need the reference number as well.,Hotel,494
Your rooms for 6 have been reserved at the Lensfield Hotel. Reference number: P00B5C1R. Can I help you with anything else today?,,495
"Yes please, I  need a trains going to london liverpool street.",Train,496
Sure. Where will you be departing from?,Train,497
I'll be leaving Cambridge on Tuesday and need to arrive by 13:15.,Train,498
I've booked 6 tickets for you.  The total is 99.6 GBP and your reference number is VZX1QAGN. Can I help you with anything else today?,,499
"No, that seems to be everything. Thank you.",,500
Perfect. Have a great day. Goodbye.,,501
I'm looking for places to go in the centre of Cambridge.,Attraction,502
There are 44 different things to do in the centre of Cambridge.  Can you help me narrow it down by type of activity or attraction?,Attraction,503
What's the postcode for your favorite one?,Attraction,504
My personal favorite is holy trinity church. They are on market st and the postcode is cb23nz. Anything else I can help you with today?,Attraction,505
I also need to book a train.,Train,506
"i have plenty of trains, can i get more information please?",Train,507
I need to leave on sunday after 12:30 from cambridge to stevenage,Train,508
"The first train after 12:30 is the TR0523, which leaves Cambridge at 13:21.",Train,509
"Great, can I get two tickets on it, please?",Train,510
"I've booked two tickets for the TR0523 train, and your reference number is R6GCVVA0. Can I help you with anything else today?",,511
"No, thank you. You've been very helpful! Goodbye.",,512
Thank you for contacting Cambridge TownInfo centre.  I hope you have a pleasant trip!  Goodbye!,,513
I am looking for a train departing from Stevenage.,Train,514
Where will you be leaving from?,Train,515
"Stevenage, on Tuesday.",Train,516
What time are you looking to depart?,Train,517
I am leaving at 20:30.,Train,518
"Okay, I have two trains that might work. TR9084 departs at 21:54 and TR3606 leaves at 23:54. Both have a duration of 49 minutes and cost 12.80 pounds. Anything else today?",Train,519
"Let's go with TR9084, please.",,520
Okay I have booked that for you and your reference number is 6GRN0MSA. Anything else I can do for you?,,521
No that is all thank you very much.,,522
Thank you for using our service. Have all of your needs been met?,,523
"Yes, thank you very much.",,524
You're quite welcome. Goodbye!,,525
I need a train to Peterborough on Monday.,Train,526
"The earliest train is at 5:06, do you want me to book it?",Train,527
Does it arrive by 16:00?,Train,528
"Yes, it arrives at 05:56.",Train,529
"Are there any later trains? Also I need to get the price, departure time, and train ID when we find a suitable one.",Train,530
Yes I have trains that arrive from 5:56 to 15:24. Any preference?,Train,531
What is the train ID and response of the train that arrives at 15:24? I would like to book that one.,Train,532
Train TR4765 leaves at 15:06 and arrives at 15:56 and costs 16.50 pounds. How many tickets would you like to book?,Train,533
I need a train that departs from Cambridge. Does TR4765 go from Cambridge to Peterborough?,Train,534
"Yes TR4765 departs cambridge monday at 15:06, arriving in peterborough by 15:56.  How many tickets will you need?",Train,535
I was just looking for information for now. I do need some additional information on a place to eat though.,,536
There are 110 restaurants in the area - are you looking for a specific type of cuisine?,Restaurant,537
I am thinking Indian food would be perfect and in the centre.,Restaurant,538
There are 22 Indian restaurants in Cambridge. Do you have a preferred price range or area in town you'd like to dine?,Restaurant,539
I do not have a specific price or location in mind.  Please just send me the address and phone number of an Indian restaurant.,Restaurant,540
"Okay I have chosen the Curry Prince for you, which is a very popular location. Their address is 	451 Newmarket Road Fen Ditton and their telephone number is 01223566388.",Restaurant,541
Thank you. That is all I needed.,,542
You are welcome.  Goodbye.,,543
"Hey, are there any interesting attractions in towncentre today?",Attraction,544
Great saint mary's church is an architecture location in the centre of town.,Attraction,545
Great.  What is the phone number?,Attraction,546
The phone number is 01223350914.,Attraction,547
"Thank you, are there in Korean restaurants in the centre area?",Restaurant,548
There is Little Seoul located at 108 Regent Street City Centre.  Would you like to book a table there?,Booking,549
No thanks. I do need the phone number and post code.,Restaurant,550
Sure! Their phone number is 01223308681. Their postcode is cb21dp. Anything else I can help with?,,551
"Thanks. I will need a taxi to get from the church attraction to the restaurant, please.",Taxi,552
What time would you like taxi to pick you up from the church?,Taxi,553
I'd like to leave at 11:45. Can I have the contact number and car type please?,Taxi,554
"A grey VW will pick you up, and the contact number is 07216248494. Can I help you with anything else today?",Taxi,555
"No that is all, thank you!",,556
You are very welcome. Good day.,,557
Can you find specific attractions for people?,Attraction,558
I can try.  What are you trying to find?,Attraction,559
I am looking for people's portraits exhibition.,,560
"Yes, it's a lovely museum in the west at girton college, huntingdon road. Their phone number is 01223338901 and they offer free entrance. May I help with anything else?",,561
can you give me the post code for it?,Attraction,562
The post code is cb3ojg. May I help with anything else?,,563
"Yes, I would also like to find a restaurant called Golden House please.",Restaurant,564
They're located in the centre. Would you like a reservation?,Booking,565
"Yes, how about a table for 8 on saturday. Try 19:30, if that doesn't work then try 18:30.",Restaurant,566
I was able to book you at 18:30 on Saturday. Reference number 3C5H16N9. Is there anything else I can help you with?,,567
"That is all, thank you.",,568
Thank you very much! Have a great day,,569
"Hello, I need a train on Wednesday arriving at 14:30.",Train,570
"Ok, I can help you with that. Where will you be departing from?",Train,571
I am departing from Cambridge and going to Leicester and I need to arrive by 14:30.,Train,572
TR2176 leaves at 09:21. can i book for you?,Train,573
please make a booking for 3 people. Make sure you get the reference number,Train,574
"Booking was successful, the total fee is 113.4 GBP payable at the station . Reference number is : FHU6LGXD. is there anything else i could help you with?",,575
I'm looking for some information about a and b guest house.,Hotel,576
"It is located in the east, is moderately priced, and has a 4 star rating.  It has free internet.  It's located at 124 Tenison Road.",Hotel,577
Thank you. Can I also get the phone number?,Hotel,578
Sure. Their phone number is 01223315702. Anything more I can help with?,Hotel,579
"No, that is all I need for now.",,580
It's been my pleasure. Goodbye,,581
I'm interested in rooms for the night where you can get free wifi.,Hotel,582
There are 32 hotels or guesthouses with free wifi. What price range are you looking for?,Hotel,583
"I'm looking for something in a moderate price range, but it must have at least a 4 star rating.",Hotel,584
"What part of town are you interested in? East, north or south?",Hotel,585
I don't have a preference for the area.,,586
How about a and b guest house?,Hotel,587
that will be nice. get me the reference numbers,Hotel,588
When would you like to book this for?,Booking,589
Please book for Sunday for 3 nights and 6 people.,Hotel,590
"Sorry, the hotel can't accommodate you for that time frame? Want to try a different date?",Booking,591
"No, I need it for those days. Can you try different hotel?",Hotel,592
"I can try for the Acorn Guest House, if you'd like. They're on Chesterton Road.",Hotel,593
Sounds good. Can you try and book that one please.,,594
"Sorry, the Acorn Guest house is not able to accomodate you either. I checked with the other moderately priced 4 star lodgings with free wifi, and none have those dates available. Will any other stay work for you?",Booking,595
Can we try for just 2 nights then?,Hotel,596
I've booked that for you. The reference number is 3CRY3DDP. May I help with anything else?,,597
"nope, that's all I need thank you!",,598
You're welcome. Have a great day.,,599
can you find me a guest house that has free wifi in this town?,Hotel,600
There are 23 guesthouses in town with free wifi. Do you have a price range?,Hotel,601
How about one that has a 4 star rating and is expensive?,Hotel,602
"Unfortunately, there are no guesthouses that meet you needs. There are 2 hotels if you are interested.",Hotel,603
"What about something in the moderate price range, instead?",Hotel,604
Yes I have many choices in that category. Would you like me to suggest something?,Hotel,605
book a hotel for 8 people and 3 nights starting from saturday.,Hotel,606
Please clarify if you want a guesthouse or a hotel. There are no hotels that match your needs but there are 11 guesthouses that do.,Hotel,607
I want a guesthouse.,Hotel,608
Would you like me to book you for avalon?,Booking,609
"Yes, please book for 8 people for 3 nights, starting from Saturday.",Hotel,610
You're all set to arrive on Saturday. Your Reference number is : 5D3TISUX.,Booking,611
"great, thanks. i'm also looking for places to go in town.",,612
Ok.  There are many great things to do in town.  Did you have something particular in mind?,,613
I would like a place that is fun and serves drinks.,,614
Sure! Would you rather a nightclub type of environment or more of a park or entertainment venue?,Attraction,615
"Actually, is there a swimming pool around?",Attraction,616
which part of town should it be?,Attraction,617
it should be in the south,Attraction,618
"I'm sorry, but there are no swimming pools in the south. Would you like to try a different area or attraction type?",Attraction,619
what options are available,Attraction,620
"There are swimming pools in the east, north and centre of town. The south has cinema, entertainment, museum, nightclub, theatre and parks. Have a preference?",Attraction,621
I would prefer the south please.,,622
"What type of attraction in the south? There are 8 results ranging from cinema, museums, nightclubs, parks.  Which would interest you?",Attraction,623
"If there are no swimming pools in the south, then I would consider a cinema in the south of town.",Attraction,624
